{
  "veduta": "scenario/1",
  "scene": "main",
  "seed": 42,
  "ticks": 60,
  "inputs": [
    { "tick": 3, "press": ["right"] },
    { "tick": 13, "release": ["right"] },
    { "tick": 17, "press": ["down"] },
    { "tick": 27, "release": ["down"] },
    { "tick": 30, "press": ["a"] },
    { "tick": 31, "release": ["a"] }
  ],
  "expect": [
    { "tick": 13, "entity": "player", "path": "position.x", "op": ">", "value": 1.9 },
    { "tick": 27, "entity": "player", "path": "position.z", "op": ">", "value": 1.9 },
    { "tick": 33, "entity": "player", "path": "position.y", "op": ">", "value": 0.3 },
    { "tick": 60, "entity": "player", "path": "state.on_ground", "op": "==", "value": true },
    { "tick": 60, "trace": "jump", "count_min": 1, "count_max": 1 }
  ],
  "invariants": ["finite_positions", "within_bounds", "no_overlap:player,obstacle"],
  "screenshots": [0, 13, 33, 60]
}
