{
  "veduta": "scenario/1",
  "world": "overworld",
  "at": [0, 0],
  "seed": 1,
  "ticks": 200,
  "inputs": [
    { "tick": 0, "press": ["up"] },
    { "tick": 120, "release": ["up"] },
    { "tick": 121, "press": ["right"] },
    { "tick": 180, "release": ["right"] }
  ],
  "expect": [
    { "tick": 100, "entity": "player", "path": "position.y", "op": ">", "value": 1 },
    { "tick": 120, "entity": "player", "path": "position.z", "op": "<", "value": -20 },
    { "tick": 200, "trace": "chunk_load", "count_min": 12 },
    { "tick": 200, "trace": "chunk_unload", "count_min": 3 },
    { "tick": 200, "trace": "spawn", "count_max": 0 }
  ],
  "invariants": ["finite_positions", "within_bounds", "no_overlap:player,obstacle", "entity_count_max:3000"],
  "screenshots": [0, 100, 200]
}
