{
  "veduta": "scenario/1",
  "world": "overworld",
  "at": [0, 0],
  "seed": 1,
  "ticks": 60,
  "inputs": [
    { "tick": 0, "press": ["left"] },
    { "tick": 60, "release": ["left"] }
  ],
  "expect": [
    { "tick": 20, "entity": "player", "path": "position.x", "op": "<", "value": -2 },
    { "tick": 60, "entity": "player", "path": "position.x", "op": ">", "value": -5 },
    { "tick": 60, "entity": "player", "path": "state.on_ground", "op": "==", "value": true }
  ],
  "invariants": ["finite_positions", "within_bounds", "no_overlap:player,obstacle"],
  "screenshots": [0, 20, 60]
}
